<?xml version="1.0" encoding="UTF-8"?>
<SAQAQUALIFICATIONS xmlns:xsi="http://www.w3.org/2001/XMLSchema-instance" xsi:noNamespaceSchemaLocation="qualification.xsd">
  <QUALIFICATION>
    <DOWNLOAD_DATE>2001-12-31T12:00:00</DOWNLOAD_DATE>
    <LAST_UPDATE_DATE>2001-12-31T12:00:00</LAST_UPDATE_DATE>
    <QUALIFICATION_ID>0</QUALIFICATION_ID>
    <QUALIFICATION_TITLE>QUALIFICATION_TITLE</QUALIFICATION_TITLE>
    <SGB_NAME>SGB_NAME</SGB_NAME>
    <FIELD>FIELD</FIELD>
    <PROVIDER_CODE>PROVIDER_CODE</PROVIDER_CODE>
    <PROVIDER_NAME>PROVIDER_NAME</PROVIDER_NAME>
    <PROVIDER_ETQA_ID>0</PROVIDER_ETQA_ID>
    <ETQA_ACRONYM>ETQA_ACRONYM</ETQA_ACRONYM>
    <ETQA_NAME>ETQA_NAME</ETQA_NAME>
    <QUALIFICATION_TYPE_DESC>QUALIFICATION_TYPE_DESC</QUALIFICATION_TYPE_DESC>
    <FIELD_DESCRIPTION>FIELD_DESCRIPTION</FIELD_DESCRIPTION>
    <SUBFIELD_DESCRIPTION>SUBFIELD_DESCRIPTION</SUBFIELD_DESCRIPTION>
    <ABET_BAND_DESCRIPTION>ABET_BAND_DESCRIPTION</ABET_BAND_DESCRIPTION>
    <QUALIFICATION_MINIMUM_CREDITS>0</QUALIFICATION_MINIMUM_CREDITS>
    <NQF_LEVEL_DESCRIPTION>NQF_LEVEL_DESCRIPTION</NQF_LEVEL_DESCRIPTION>
    <NQF_LEVEL_G2_DESCRIPTION>NQF_LEVEL_G2_DESCRIPTION</NQF_LEVEL_G2_DESCRIPTION>
    <QUALIFICATION_CLASS_DESC>QUALIFICATION_CLASS_DESC</QUALIFICATION_CLASS_DESC>
    <QUALIFICATION_PURPOSE>QUALIFICATION_PURPOSE</QUALIFICATION_PURPOSE>
    <QUAL_LEARNING_ASSUMED_IN_PLACE>QUAL_LEARNING_ASSUMED_IN_PLACE</QUAL_LEARNING_ASSUMED_IN_PLACE>
    <RECOGNIZE_PREV_LEARNING_FLAG>RECOGNIZE_PREV_LEARNING_FLAG</RECOGNIZE_PREV_LEARNING_FLAG>
    <QUAL_RULES_OF_COMBINATION>QUAL_RULES_OF_COMBINATION</QUAL_RULES_OF_COMBINATION>
    <ELOAC_QUALIFICATION_OUTCOME>ELOAC_QUALIFICATION_OUTCOME</ELOAC_QUALIFICATION_OUTCOME>
    <ELOAC_QUAL_ASSESSMENT_CRITERIA>ELOAC_QUAL_ASSESSMENT_CRITERIA</ELOAC_QUAL_ASSESSMENT_CRITERIA>
    <QUAL_INTL_BENCHMARKING_MEMO>QUAL_INTL_BENCHMARKING_MEMO</QUAL_INTL_BENCHMARKING_MEMO>
    <QUAL_ARTICULATION_OPTIONS>QUAL_ARTICULATION_OPTIONS</QUAL_ARTICULATION_OPTIONS>
    <QUAL_MODERATION_OPTIONS>QUAL_MODERATION_OPTIONS</QUAL_MODERATION_OPTIONS>
    <QUAL_ASSESSOR_CRITERIA>QUAL_ASSESSOR_CRITERIA</QUAL_ASSESSOR_CRITERIA>
    <QUALIFICATION_NOTES>QUALIFICATION_NOTES</QUALIFICATION_NOTES>
    <REGISTRATION_STATUS_DESC>REGISTRATION_STATUS_DESC</REGISTRATION_STATUS_DESC>
    <SAQA_DECISION_NUMBER>SAQA_DECISION_NUMBER</SAQA_DECISION_NUMBER>
    <QUAL_REGISTRATION_START_DATE>2001-12-31T12:00:00</QUAL_REGISTRATION_START_DATE>
    <QUAL_REGISTRATION_END_DATE>2001-12-31T12:00:00</QUAL_REGISTRATION_END_DATE>
    <TRANSITION_PERIOD>0</TRANSITION_PERIOD>
    <LAST_DATE_FOR_ENROLMENT>2001-12-31T12:00:00</LAST_DATE_FOR_ENROLMENT>
    <TRAIN_OUT_PERIOD>0</TRAIN_OUT_PERIOD>
    <LAST_DATE_FOR_ACHIEVEMENT>2001-12-31T12:00:00</LAST_DATE_FOR_ACHIEVEMENT>
    <IS_LEARNING_PROGRAMME>IS_LEARNING_PROGRAMME</IS_LEARNING_PROGRAMME>
    <LEARNING_PROGRAMME_QUAL>0</LEARNING_PROGRAMME_QUAL>
  </QUALIFICATION>
  <US_QUALIFICATION_LINK>
    <QUALIFICATION_ID>0</QUALIFICATION_ID>
    <US_QUAL_TYPE_DESCRIPTION>US_QUAL_TYPE_DESCRIPTION</US_QUAL_TYPE_DESCRIPTION>
    <UNIT_STD_TITLE>UNIT_STD_TITLE</UNIT_STD_TITLE>
    <UNIT_STANDARD_ID>0</UNIT_STANDARD_ID>
    <NQF_LEVEL_DESCRIPTION>NQF_LEVEL_DESCRIPTION</NQF_LEVEL_DESCRIPTION>
    <NQF_LEVEL_G2_DESCRIPTION>NQF_LEVEL_G2_DESCRIPTION</NQF_LEVEL_G2_DESCRIPTION>
    <UNIT_STD_NUMBER_OF_CREDITS>0</UNIT_STD_NUMBER_OF_CREDITS>
  </US_QUALIFICATION_LINK>
  <LP_QUALIFICATION_LINK>
    <QUALIFICATION_ID>0</QUALIFICATION_ID>
    <LP_QUALIFICATION_ID>0</LP_QUALIFICATION_ID>
    <LP_QUALIFICATION_TITLE>LP_QUALIFICATION_TITLE</LP_QUALIFICATION_TITLE>
    <LP_PROVIDER_NAME>LP_PROVIDER_NAME</LP_PROVIDER_NAME>
    <LP_NQF_LEVEL_DESCRIPTION>LP_NQF_LEVEL_DESCRIPTION</LP_NQF_LEVEL_DESCRIPTION>
    <LP_NQF_LEVEL_G2_DESCRIPTION>LP_NQF_LEVEL_G2_DESCRIPTION</LP_NQF_LEVEL_G2_DESCRIPTION>
    <LP_QUAL_MINIMUM_CREDITS>0</LP_QUAL_MINIMUM_CREDITS>
    <LP_QUAL_REGISTRATION_END_DATE>2001-12-31T12:00:00</LP_QUAL_REGISTRATION_END_DATE>
    <LP_ETQA_ACRONYM>LP_ETQA_ACRONYM</LP_ETQA_ACRONYM>
  </LP_QUALIFICATION_LINK>
</SAQAQUALIFICATIONS>
